{
 "$schema":"https://json-schema.org/draft/2020-12/schema","$id":"urn:offline-tools:project-brain-fact:1","type":"object","required":["schema_version","id","statement","status","confidence","sources","recorded_at_utc"],
 "properties":{"schema_version":{"const":"1.0"},"id":{"type":"string"},"statement":{"type":"string","minLength":1},"entities":{"type":"array","items":{"type":"string"}},"effective_date":{"type":["string","null"]},"recorded_at_utc":{"type":"string"},"status":{"enum":["active","superseded","disputed","unknown"]},"confidence":{"type":"number","minimum":0,"maximum":1},"sources":{"type":"array","minItems":1,"items":{"type":"object","required":["id"],"properties":{"id":{"type":"string"},"location":{"type":["string","null"]},"observed_at":{"type":["string","null"]}}}},"supersedes":{"type":"array","items":{"type":"string"}},"notes":{"type":["string","null"]}},"additionalProperties":true
}
